{
  "benchmark_id": "bench.agentic.pack.benchmark_authoring.v1",
  "created_at": "1970-01-01T00:00:00Z",
  "entries": [
    {
      "col_label": "p-author",
      "evaluation_relpath": "cells/v-cli__p-author/evaluation.json",
      "prompt_id": "p-author",
      "row_label": "v-cli",
      "total_weighted_score": 0.236089,
      "variant_id": "v-cli"
    }
  ],
  "matrix_id": "agentic-pack-benchmark-authoring-example-grid",
  "metric": "total_weighted_rubric_score",
  "run_id": "agentic-pack-benchmark-authoring-example",
  "schema_version": 1
}
