{
  "benchmark_id": "bench.examples.registry.mixed.v1",
  "created_at": "1970-01-01T00:00:00Z",
  "entries": [
    {
      "col_label": "p-inline",
      "evaluation_relpath": "cells/v-cli__p-inline/evaluation.json",
      "prompt_id": "p-inline",
      "row_label": "v-cli",
      "total_weighted_score": 0.672211,
      "variant_id": "v-cli"
    },
    {
      "col_label": "p-reg",
      "evaluation_relpath": "cells/v-cli__p-reg/evaluation.json",
      "prompt_id": "p-reg",
      "row_label": "v-cli",
      "total_weighted_score": 0.527693,
      "variant_id": "v-cli"
    }
  ],
  "matrix_id": "examples-registry-mixed-grid",
  "metric": "total_weighted_rubric_score",
  "run_id": "examples-registry-mixed",
  "schema_version": 1
}
