{
  "benchmark_id": "bench.agentic.pack.docs_drift_repair.v1",
  "created_at": "1970-01-01T00:00:00Z",
  "entries": [
    {
      "col_label": "p-drift",
      "evaluation_relpath": "cells/v-cli__p-drift/evaluation.json",
      "prompt_id": "p-drift",
      "row_label": "v-cli",
      "total_weighted_score": 0.699601,
      "variant_id": "v-cli"
    }
  ],
  "matrix_id": "agentic-pack-docs-drift-example-grid",
  "metric": "total_weighted_rubric_score",
  "run_id": "agentic-pack-docs-drift-example",
  "schema_version": 1
}
