{
  "benchmark_id": "bench.examples.taxonomy.runtime_config.v1",
  "created_at": "1970-01-01T00:00:00Z",
  "entries": [
    {
      "col_label": "p-runtime",
      "evaluation_relpath": "cells/v-cli__p-runtime/evaluation.json",
      "prompt_id": "p-runtime",
      "row_label": "v-cli",
      "total_weighted_score": 0.765143,
      "variant_id": "v-cli"
    }
  ],
  "matrix_id": "taxonomy-runtime-example-grid",
  "metric": "total_weighted_rubric_score",
  "run_id": "taxonomy-runtime-example",
  "schema_version": 1
}
